[
  {
    "crop": "山东金乡大蒜",
    "nodeSeq": 1,
    "daysAfterSowing": 0,
    "operationType": "sowing",
    "name": "播种",
    "description": "适期播种，深度一致，覆土镇压",
    "source": "金乡大蒜栽培技术推广资料",
    "category": "vegetable"
  },
  {
    "crop": "山东金乡大蒜",
    "nodeSeq": 2,
    "daysAfterSowing": 7,
    "operationType": "emergence",
    "name": "出苗",
    "description": "检查出苗情况，缺苗补种",
    "source": "金乡大蒜栽培技术推广资料",
    "category": "vegetable"
  },
  {
    "crop": "山东金乡大蒜",
    "nodeSeq": 3,
    "daysAfterSowing": 60,
    "operationType": "irrigation",
    "name": "越冬前灌溉",
    "description": "浇越冬水，保苗安全越冬",
    "source": "山东省大蒜地方种植标准",
    "category": "vegetable"
  },
  {
    "crop": "山东金乡大蒜",
    "nodeSeq": 4,
    "daysAfterSowing": 120,
    "operationType": "irrigation",
    "name": "返青水",
    "description": "返青期浇水，促进恢复生长",
    "source": "山东省大蒜地方种植标准",
    "category": "vegetable"
  },
  {
    "crop": "山东金乡大蒜",
    "nodeSeq": 5,
    "daysAfterSowing": 140,
    "operationType": "fertilizer",
    "name": "返青追肥",
    "description": "返青期追施氮肥，规避降雨与低温",
    "source": "金乡大蒜施肥技术资料",
    "category": "vegetable"
  },
  {
    "crop": "山东金乡大蒜",
    "nodeSeq": 6,
    "daysAfterSowing": 170,
    "operationType": "pesticide",
    "name": "抽薹期打药",
    "description": "防治叶枯病与蒜蛆，避雨避风",
    "source": "大蒜病虫害防治手册",
    "category": "vegetable"
  },
  {
    "crop": "山东金乡大蒜",
    "nodeSeq": 7,
    "daysAfterSowing": 190,
    "operationType": "irrigation",
    "name": "抽薹期灌溉",
    "description": "保持土壤湿润，利于抽薹",
    "source": "山东省大蒜地方种植标准",
    "category": "vegetable"
  },
  {
    "crop": "山东金乡大蒜",
    "nodeSeq": 8,
    "daysAfterSowing": 205,
    "operationType": "harvest",
    "name": "蒜薹采收",
    "description": "蒜薹适时采收，遇雨提前抢收",
    "source": "金乡大蒜采收技术资料",
    "category": "vegetable"
  },
  {
    "crop": "山东金乡大蒜",
    "nodeSeq": 9,
    "daysAfterSowing": 235,
    "operationType": "fertilizer",
    "name": "鳞茎膨大追肥",
    "description": "追施磷钾肥，促进鳞茎膨大",
    "source": "金乡大蒜施肥技术资料",
    "category": "vegetable"
  },
  {
    "crop": "山东金乡大蒜",
    "nodeSeq": 10,
    "daysAfterSowing": 260,
    "operationType": "harvest",
    "name": "蒜头采收",
    "description": "叶片转黄时采收，晾晒入储",
    "source": "金乡大蒜采收技术资料",
    "category": "vegetable"
  },
  {
    "crop": "山东金乡大蒜",
    "nodeSeq": 11,
    "daysAfterSowing": 155,
    "operationType": "pesticide",
    "name": "返青后防蒜蛆",
    "description": "返青后防治蒜蛆，避雨避风",
    "source": "大蒜病虫害防治手册",
    "category": "vegetable"
  },
  {
    "crop": "山东金乡大蒜",
    "nodeSeq": 12,
    "daysAfterSowing": 178,
    "operationType": "irrigation",
    "name": "抽薹前灌溉",
    "description": "抽薹前补水，保障抽薹整齐",
    "source": "山东省大蒜地方种植标准",
    "category": "vegetable"
  },
  {
    "crop": "山东金乡大蒜",
    "nodeSeq": 13,
    "daysAfterSowing": 285,
    "operationType": "other",
    "name": "蒜头晾晒入储",
    "description": "蒜头晾晒分级后入仓储藏",
    "source": "金乡大蒜采收技术资料",
    "category": "vegetable"
  },
  {
    "crop": "河南新乡小麦",
    "nodeSeq": 1,
    "daysAfterSowing": 0,
    "operationType": "sowing",
    "name": "播种",
    "description": "适墒适期播种，控制播量",
    "source": "河南小麦栽培技术推广资料",
    "category": "grain"
  },
  {
    "crop": "河南新乡小麦",
    "nodeSeq": 2,
    "daysAfterSowing": 7,
    "operationType": "emergence",
    "name": "出苗",
    "description": "查苗补种，确保基本苗",
    "source": "河南小麦栽培技术推广资料",
    "category": "grain"
  },
  {
    "crop": "河南新乡小麦",
    "nodeSeq": 3,
    "daysAfterSowing": 60,
    "operationType": "irrigation",
    "name": "分蘖水",
    "description": "分蘖期补水，促根增蘖",
    "source": "河南省小麦地方种植标准",
    "category": "grain"
  },
  {
    "crop": "河南新乡小麦",
    "nodeSeq": 4,
    "daysAfterSowing": 120,
    "operationType": "irrigation",
    "name": "越冬水",
    "description": "浇越冬水，防冻保苗",
    "source": "河南省小麦地方种植标准",
    "category": "grain"
  },
  {
    "crop": "河南新乡小麦",
    "nodeSeq": 5,
    "daysAfterSowing": 150,
    "operationType": "fertilizer",
    "name": "返青追肥",
    "description": "返青期追施氮肥，避开低温降雨",
    "source": "小麦施肥技术资料",
    "category": "grain"
  },
  {
    "crop": "河南新乡小麦",
    "nodeSeq": 6,
    "daysAfterSowing": 170,
    "operationType": "pesticide",
    "name": "返青期打药",
    "description": "防治纹枯病，避雨避风",
    "source": "小麦病虫害防治手册",
    "category": "grain"
  },
  {
    "crop": "河南新乡小麦",
    "nodeSeq": 7,
    "daysAfterSowing": 200,
    "operationType": "fertilizer",
    "name": "拔节肥",
    "description": "拔节期追肥，看苗调控",
    "source": "小麦施肥技术资料",
    "category": "grain"
  },
  {
    "crop": "河南新乡小麦",
    "nodeSeq": 8,
    "daysAfterSowing": 220,
    "operationType": "irrigation",
    "name": "抽穗灌溉",
    "description": "抽穗扬花期保证水分供应",
    "source": "河南省小麦地方种植标准",
    "category": "grain"
  },
  {
    "crop": "河南新乡小麦",
    "nodeSeq": 9,
    "daysAfterSowing": 240,
    "operationType": "pesticide",
    "name": "灌浆期打药",
    "description": "防治赤霉病与蚜虫，避雨",
    "source": "小麦病虫害防治手册",
    "category": "grain"
  },
  {
    "crop": "河南新乡小麦",
    "nodeSeq": 10,
    "daysAfterSowing": 260,
    "operationType": "harvest",
    "name": "成熟采收",
    "description": "蜡熟末期收获，遇雨抢收",
    "source": "小麦收获技术资料",
    "category": "grain"
  },
  {
    "crop": "河南新乡小麦",
    "nodeSeq": 11,
    "daysAfterSowing": 90,
    "operationType": "other",
    "name": "冬前化学除草",
    "description": "冬前化除，避风避雨",
    "source": "小麦田间管理资料",
    "category": "grain"
  },
  {
    "crop": "河南新乡小麦",
    "nodeSeq": 12,
    "daysAfterSowing": 130,
    "operationType": "pesticide",
    "name": "越冬期防病",
    "description": "越冬期防治纹枯病，避低温",
    "source": "小麦病虫害防治手册",
    "category": "grain"
  },
  {
    "crop": "河南新乡小麦",
    "nodeSeq": 13,
    "daysAfterSowing": 280,
    "operationType": "other",
    "name": "晾晒入储",
    "description": "籽粒晾晒至安全水分后入储",
    "source": "小麦收获技术资料",
    "category": "grain"
  },
  {
    "crop": "黑龙江绥化玉米",
    "nodeSeq": 1,
    "daysAfterSowing": 0,
    "operationType": "sowing",
    "name": "播种",
    "description": "地温稳定后播种，镇压保墒",
    "source": "黑龙江玉米栽培技术推广资料",
    "category": "grain"
  },
  {
    "crop": "黑龙江绥化玉米",
    "nodeSeq": 2,
    "daysAfterSowing": 6,
    "operationType": "emergence",
    "name": "出苗",
    "description": "查苗补苗，破除板结",
    "source": "黑龙江玉米栽培技术推广资料",
    "category": "grain"
  },
  {
    "crop": "黑龙江绥化玉米",
    "nodeSeq": 3,
    "daysAfterSowing": 25,
    "operationType": "other",
    "name": "苗期除草",
    "description": "苗期化学除草，避风避雨",
    "source": "玉米田间管理资料",
    "category": "grain"
  },
  {
    "crop": "黑龙江绥化玉米",
    "nodeSeq": 4,
    "daysAfterSowing": 40,
    "operationType": "fertilizer",
    "name": "苗期追肥",
    "description": "苗期追施氮肥，促进生长",
    "source": "玉米施肥技术资料",
    "category": "grain"
  },
  {
    "crop": "黑龙江绥化玉米",
    "nodeSeq": 5,
    "daysAfterSowing": 55,
    "operationType": "fertilizer",
    "name": "大喇叭口追肥",
    "description": "大喇叭口期重施穗肥",
    "source": "玉米施肥技术资料",
    "category": "grain"
  },
  {
    "crop": "黑龙江绥化玉米",
    "nodeSeq": 6,
    "daysAfterSowing": 65,
    "operationType": "irrigation",
    "name": "抽雄前灌溉",
    "description": "抽雄前补水，防卡脖旱",
    "source": "玉米灌溉技术资料",
    "category": "grain"
  },
  {
    "crop": "黑龙江绥化玉米",
    "nodeSeq": 7,
    "daysAfterSowing": 70,
    "operationType": "pesticide",
    "name": "抽雄期打药",
    "description": "防治玉米螟，避雨避风",
    "source": "玉米病虫害防治手册",
    "category": "grain"
  },
  {
    "crop": "黑龙江绥化玉米",
    "nodeSeq": 8,
    "daysAfterSowing": 90,
    "operationType": "fertilizer",
    "name": "灌浆追肥",
    "description": "灌浆期补肥防早衰",
    "source": "玉米施肥技术资料",
    "category": "grain"
  },
  {
    "crop": "黑龙江绥化玉米",
    "nodeSeq": 9,
    "daysAfterSowing": 110,
    "operationType": "irrigation",
    "name": "灌浆灌溉",
    "description": "灌浆期保水，促进粒重",
    "source": "玉米灌溉技术资料",
    "category": "grain"
  },
  {
    "crop": "黑龙江绥化玉米",
    "nodeSeq": 10,
    "daysAfterSowing": 125,
    "operationType": "harvest",
    "name": "成熟采收",
    "description": "完熟期收获，遇雨抢收",
    "source": "玉米收获技术资料",
    "category": "grain"
  },
  {
    "crop": "黑龙江绥化玉米",
    "nodeSeq": 11,
    "daysAfterSowing": 15,
    "operationType": "other",
    "name": "间苗定苗",
    "description": "间苗定苗，去弱留壮",
    "source": "玉米田间管理资料",
    "category": "grain"
  },
  {
    "crop": "黑龙江绥化玉米",
    "nodeSeq": 12,
    "daysAfterSowing": 100,
    "operationType": "pesticide",
    "name": "灌浆期防虫",
    "description": "灌浆期防治玉米螟与蚜虫",
    "source": "玉米病虫害防治手册",
    "category": "grain"
  },
  {
    "crop": "黑龙江绥化玉米",
    "nodeSeq": 13,
    "daysAfterSowing": 140,
    "operationType": "other",
    "name": "秸秆处理",
    "description": "秸秆还田或清运处理",
    "source": "玉米收获技术资料",
    "category": "grain"
  },
  {
    "crop": "湖北荆州水稻",
    "nodeSeq": 1,
    "daysAfterSowing": 0,
    "operationType": "sowing",
    "name": "育秧播种",
    "description": "适期育秧，控温控水",
    "source": "湖北水稻栽培技术推广资料",
    "category": "grain"
  },
  {
    "crop": "湖北荆州水稻",
    "nodeSeq": 2,
    "daysAfterSowing": 12,
    "operationType": "emergence",
    "name": "出苗",
    "description": "秧苗管理，防止徒长",
    "source": "湖北水稻栽培技术推广资料",
    "category": "grain"
  },
  {
    "crop": "湖北荆州水稻",
    "nodeSeq": 3,
    "daysAfterSowing": 25,
    "operationType": "other",
    "name": "移栽",
    "description": "适龄移栽，合理密植",
    "source": "水稻栽培技术资料",
    "category": "grain"
  },
  {
    "crop": "湖北荆州水稻",
    "nodeSeq": 4,
    "daysAfterSowing": 35,
    "operationType": "fertilizer",
    "name": "返青肥",
    "description": "返青期追肥，促进分蘖",
    "source": "水稻施肥技术资料",
    "category": "grain"
  },
  {
    "crop": "湖北荆州水稻",
    "nodeSeq": 5,
    "daysAfterSowing": 45,
    "operationType": "fertilizer",
    "name": "分蘖肥",
    "description": "分蘖期追肥，看苗施用",
    "source": "水稻施肥技术资料",
    "category": "grain"
  },
  {
    "crop": "湖北荆州水稻",
    "nodeSeq": 6,
    "daysAfterSowing": 55,
    "operationType": "pesticide",
    "name": "分蘖期打药",
    "description": "防治二化螟，避雨避风",
    "source": "水稻病虫害防治手册",
    "category": "grain"
  },
  {
    "crop": "湖北荆州水稻",
    "nodeSeq": 7,
    "daysAfterSowing": 70,
    "operationType": "irrigation",
    "name": "晒田灌溉",
    "description": "适时晒田，控制无效分蘖",
    "source": "水稻水分管理资料",
    "category": "grain"
  },
  {
    "crop": "湖北荆州水稻",